<?xml version="1.0" encoding="UTF-8"?>

<!DOCTYPE channel-definition SYSTEM "channelDefinition.dtd">

<channel-definition>

    <title>Test Portlet 1</title>
    <name>Test Portlet 1</name>
    <fname>test-portlet-1</fname>
    <desc>Test portlet 1 from Apache Pluto</desc>
    <type>Custom</type>
    <class>org.jasig.portal.channels.portlet.CPortletAdapter</class>
    <timeout>60000</timeout>
    
    <hasedit>N</hasedit>
    <hashelp>N</hashelp>
    <hasabout>N</hasabout>

    <secure>N</secure>
    <locale>en_US</locale>
    
    <categories>
        <category>Development</category>
    </categories>
    
    <groups>
        <group>Everyone</group>
    </groups>
    
    <parameters>

        <parameter>
            <name>portletDefinitionId</name>
            <value>testsuite.TestPortlet1</value>
            <description>Identifies the portlet deployed within the portlet container</description>
            <ovrd>N</ovrd>
        </parameter>

    </parameters>
    
</channel-definition>
