<?xml version="1.0" encoding="UTF-8"?>

<!DOCTYPE channel-definition SYSTEM "channelDefinition.dtd">

<channel-definition>

    <title>Fragment Manager</title>
    <name>Fragment Manager</name>
    <fname>fragment-manager</fname>
    <desc>The fragment constructor/publisher channel</desc>
    <type>Custom</type>
    <class>org.jasig.portal.layout.channels.CFragmentManager</class>
    <timeout>5000</timeout>
    
    <hasedit>N</hasedit>
    <hashelp>N</hashelp>
    <hasabout>N</hasabout>

    <secure>N</secure>
    <locale>en_US</locale>
    
    <categories>
    </categories>
    
    <groups>
        <group>Everyone</group>
    </groups>
    
    <parameters/>
    
</channel-definition>
